{
  "schemaVersion": "1.0.0",
  "configId": "odoo-faq-authoring",
  "authoringVersion": "3.0.0",
  "snapshotId": "odoo-019-foundation",
  "rootContract": {
    "id": "ds.faq",
    "version": "2.1.1"
  },
  "rootActions": [
    {
      "action": "move",
      "verdict": "allowed"
    },
    {
      "action": "duplicate",
      "verdict": "allowed"
    },
    {
      "action": "remove",
      "verdict": "allowed"
    },
    {
      "action": "save-as-custom",
      "verdict": "forbidden"
    },
    {
      "action": "resize",
      "verdict": "forbidden"
    },
    {
      "action": "background",
      "verdict": "forbidden"
    }
  ],
  "controls": [
    {
      "decisionId": "faq-ctl-faq-presentation",
      "address": {
        "componentPath": [
          {
            "contract": {
              "id": "ds.faq",
              "version": "2.1.1"
            }
          }
        ],
        "prop": "presentation"
      },
      "verdict": "fixed-by-composition",
      "mechanism": "none",
      "targetSelector": ".s_pqr_faq",
      "label": "presentation"
    },
    {
      "decisionId": "faq-ctl-faq-items",
      "address": {
        "componentPath": [
          {
            "contract": {
              "id": "ds.faq",
              "version": "2.1.1"
            }
          }
        ],
        "prop": "items"
      },
      "verdict": "fixed-by-composition",
      "mechanism": "none"
    },
    {
      "decisionId": "faq-ctl-faq-bouton-button-variant",
      "address": {
        "componentPath": [
          {
            "contract": {
              "id": "ds.faq",
              "version": "2.1.1"
            }
          },
          {
            "contract": {
              "id": "ds.button",
              "version": "3.0.0"
            },
            "viaPart": "Bouton"
          }
        ],
        "prop": "variant"
      },
      "verdict": "fixed-by-composition",
      "mechanism": "none"
    },
    {
      "decisionId": "faq-ctl-faq-bouton-button-children",
      "address": {
        "componentPath": [
          {
            "contract": {
              "id": "ds.faq",
              "version": "2.1.1"
            }
          },
          {
            "contract": {
              "id": "ds.button",
              "version": "3.0.0"
            },
            "viaPart": "Bouton"
          }
        ],
        "prop": "children"
      },
      "verdict": "fixed-by-composition",
      "mechanism": "plain-text"
    },
    {
      "decisionId": "faq-ctl-faq-bouton-button-ico-eft",
      "address": {
        "componentPath": [
          {
            "contract": {
              "id": "ds.faq",
              "version": "2.1.1"
            }
          },
          {
            "contract": {
              "id": "ds.button",
              "version": "3.0.0"
            },
            "viaPart": "Bouton"
          }
        ],
        "prop": "iconLeft"
      },
      "verdict": "fixed-by-composition",
      "mechanism": "none"
    },
    {
      "decisionId": "faq-ctl-faq-bouton-button-ico-ight",
      "address": {
        "componentPath": [
          {
            "contract": {
              "id": "ds.faq",
              "version": "2.1.1"
            }
          },
          {
            "contract": {
              "id": "ds.button",
              "version": "3.0.0"
            },
            "viaPart": "Bouton"
          }
        ],
        "prop": "iconRight"
      },
      "verdict": "fixed-by-composition",
      "mechanism": "none"
    },
    {
      "decisionId": "faq-ctl-faq-bouton-button-ico-ef-lyph",
      "address": {
        "componentPath": [
          {
            "contract": {
              "id": "ds.faq",
              "version": "2.1.1"
            }
          },
          {
            "contract": {
              "id": "ds.button",
              "version": "3.0.0"
            },
            "viaPart": "Bouton"
          }
        ],
        "prop": "iconLeftGlyph"
      },
      "verdict": "fixed-by-composition",
      "mechanism": "none"
    },
    {
      "decisionId": "faq-ctl-faq-bouton-button-ico-igh-lyph",
      "address": {
        "componentPath": [
          {
            "contract": {
              "id": "ds.faq",
              "version": "2.1.1"
            }
          },
          {
            "contract": {
              "id": "ds.button",
              "version": "3.0.0"
            },
            "viaPart": "Bouton"
          }
        ],
        "prop": "iconRightGlyph"
      },
      "verdict": "fixed-by-composition",
      "mechanism": "none"
    },
    {
      "decisionId": "faq-ctl-faq-accordio-ow-accordion-row-taille",
      "address": {
        "componentPath": [
          {
            "contract": {
              "id": "ds.faq",
              "version": "2.1.1"
            }
          },
          {
            "contract": {
              "id": "ds.accordion-row",
              "version": "2.2.0"
            },
            "viaPart": "AccordionRow",
            "repeat": true
          }
        ],
        "prop": "taille"
      },
      "verdict": "fixed-by-composition",
      "mechanism": "none"
    },
    {
      "decisionId": "faq-ctl-faq-accordio-ow-accordion-row-etat",
      "address": {
        "componentPath": [
          {
            "contract": {
              "id": "ds.faq",
              "version": "2.1.1"
            }
          },
          {
            "contract": {
              "id": "ds.accordion-row",
              "version": "2.2.0"
            },
            "viaPart": "AccordionRow",
            "repeat": true
          }
        ],
        "prop": "etat"
      },
      "verdict": "fixed-by-composition",
      "mechanism": "none"
    },
    {
      "decisionId": "faq-ctl-faq-accordio-ow-accordion-row-titre",
      "address": {
        "componentPath": [
          {
            "contract": {
              "id": "ds.faq",
              "version": "2.1.1"
            }
          },
          {
            "contract": {
              "id": "ds.accordion-row",
              "version": "2.2.0"
            },
            "viaPart": "AccordionRow",
            "repeat": true
          }
        ],
        "prop": "titre"
      },
      "verdict": "fixed-by-composition",
      "mechanism": "plain-text"
    },
    {
      "decisionId": "faq-ctl-faq-accordio-ow-accordion-row-contenu",
      "address": {
        "componentPath": [
          {
            "contract": {
              "id": "ds.faq",
              "version": "2.1.1"
            }
          },
          {
            "contract": {
              "id": "ds.accordion-row",
              "version": "2.2.0"
            },
            "viaPart": "AccordionRow",
            "repeat": true
          }
        ],
        "prop": "contenu"
      },
      "verdict": "fixed-by-composition",
      "mechanism": "plain-text"
    }
  ],
  "parts": [
    {
      "decisionId": "faq-part-faq-root",
      "address": {
        "componentPath": [
          {
            "contract": {
              "id": "ds.faq",
              "version": "2.1.1"
            }
          }
        ],
        "partPath": [
          "root"
        ]
      },
      "verdict": "not-editable",
      "contentKind": "structural",
      "selector": ".s_pqr_faq [data-pqr-part=\"root\"]",
      "allowedMarks": []
    },
    {
      "decisionId": "faq-part-faq-root-bouton",
      "address": {
        "componentPath": [
          {
            "contract": {
              "id": "ds.faq",
              "version": "2.1.1"
            }
          }
        ],
        "partPath": [
          "root",
          "Bouton"
        ]
      },
      "verdict": "not-editable",
      "contentKind": "component",
      "selector": ".s_pqr_faq [data-pqr-part=\"root-bouton\"]",
      "allowedMarks": []
    },
    {
      "decisionId": "faq-part-faq-root-sectio-eader",
      "address": {
        "componentPath": [
          {
            "contract": {
              "id": "ds.faq",
              "version": "2.1.1"
            }
          }
        ],
        "partPath": [
          "root",
          "SectionHeader"
        ]
      },
      "verdict": "not-editable",
      "contentKind": "structural",
      "selector": ".s_pqr_faq [data-pqr-part=\"section-header\"]",
      "allowedMarks": []
    },
    {
      "decisionId": "faq-part-faq-root-accordion",
      "address": {
        "componentPath": [
          {
            "contract": {
              "id": "ds.faq",
              "version": "2.1.1"
            }
          }
        ],
        "partPath": [
          "root",
          "accordion"
        ]
      },
      "verdict": "not-editable",
      "contentKind": "structural",
      "selector": ".s_pqr_faq [data-pqr-part=\"root-accordion\"]",
      "allowedMarks": []
    },
    {
      "decisionId": "faq-part-faq-root-accordion-accordio-ow",
      "address": {
        "componentPath": [
          {
            "contract": {
              "id": "ds.faq",
              "version": "2.1.1"
            }
          }
        ],
        "partPath": [
          "root",
          "accordion",
          "AccordionRow"
        ]
      },
      "verdict": "not-editable",
      "contentKind": "repeat",
      "selector": ".s_pqr_faq [data-pqr-part=\"root-accordion-accordio-ow\"]",
      "allowedMarks": []
    },
    {
      "decisionId": "faq-part-faq-bouton-button-root",
      "address": {
        "componentPath": [
          {
            "contract": {
              "id": "ds.faq",
              "version": "2.1.1"
            }
          },
          {
            "contract": {
              "id": "ds.button",
              "version": "3.0.0"
            },
            "viaPart": "Bouton"
          }
        ],
        "partPath": [
          "root"
        ]
      },
      "verdict": "not-editable",
      "contentKind": "structural",
      "selector": ".s_pqr_faq [data-pqr-part=\"root\"]",
      "allowedMarks": []
    },
    {